{
  "schema_version": "1",
  "contract_version": "AOS-SPEC-006",
  "id": "aos.reference.repository",
  "version": "1.0.0",
  "type": "tool",
  "owner": "AOS project",
  "namespace": "aos.reference.repository",
  "aos_compatibility": ">=0.1.0, <0.2.0",
  "dependencies": [],
  "capabilities": [
    {
      "name": "aos.reference.repository.summary",
      "host_operation": "repository.summary@1.0.0",
      "operation_class": "read_only",
      "resource_scopes": [
        "repository:."
      ],
      "idempotent": true,
      "retryable": true,
      "compensatable": false,
      "reconciliation_required": false
    }
  ],
  "data_ownership": "aos.reference.repository",
  "security": {
    "network": false,
    "secrets": false,
    "process": false
  },
  "failure_behavior": "fail_closed"
}
